{
  "report_schema_version": "0.1",
  "generated_at": "2026-07-01T00:00:00Z",
  "candidate": { "name": "App C", "pna_spec_version": "0.2", "picks_source": "inferred" },
  "summary": {
    "posture": "conformant",
    "headline": "Run 2 of App C — test fixture for the grouped (per-app run history) picker."
  },
  "findings": [
    {
      "ac_id": "AC-1",
      "ac_source": "universal",
      "status": "conformant",
      "goals": [1, 3],
      "citations": [ { "path": "src/app.c", "lines": "1", "note": "fixture" } ]
    }
  ]
}
