{
  "report_schema_version": "0.2",
  "candidate": {
    "name": "Broken fixture: user-declared nexus with no declaration recorded",
    "pna_spec_version": "0.2",
    "picks_source": "inferred",
    "classification": {
      "application_class": "text editor",
      "stores_contact_data": true,
      "stores_relationship_data": true,
      "nexus": "adjacent",
      "nexus_source": "user-declared",
      "mode": "goal-impact"
    }
  },
  "summary": {
    "posture": "not-a-pna",
    "headline": "Deliberately broken fixture: nexus_source user-declared but the verbatim user_declaration is missing. The declaration is what makes an out-of-category evaluation honest, so it must be recorded. report-fixtures-lint MUST flag this (exit 1).",
    "goal_impacts": [
      { "goal": 1, "impact": "neutral" },
      { "goal": 2, "impact": "neutral" },
      { "goal": 3, "impact": "neutral" },
      { "goal": 4, "impact": "neutral" }
    ]
  },
  "findings": [
    {
      "ac_id": "AC-1",
      "ac_source": "universal",
      "status": "not-applicable",
      "goals": [1, 3],
      "rationale": "Fixture filler so the findings array is otherwise valid."
    }
  ]
}
