{
  "report_schema_version": "0.2",
  "candidate": {
    "name": "Broken fixture: not-a-pna posture on a membership report",
    "pna_spec_version": "0.2",
    "picks_source": "declared",
    "classification": {
      "application_class": "personal relationship manager",
      "stores_contact_data": true,
      "stores_relationship_data": true,
      "nexus": "pna-candidate",
      "nexus_source": "claimed",
      "mode": "membership"
    }
  },
  "summary": {
    "posture": "not-a-pna",
    "headline": "Deliberately broken fixture: posture not-a-pna on a Mode-1 (membership) report. not-a-pna is exclusive to goal-impact reports — a PNA claimant gets a membership verdict, never a category dodge. report-fixtures-lint MUST flag this (exit 1)."
  },
  "findings": [
    {
      "ac_id": "AC-1",
      "ac_source": "universal",
      "status": "not-applicable",
      "goals": [1, 3],
      "rationale": "Fixture filler so the findings array is otherwise valid."
    }
  ]
}
