{
  "report_schema_version": "0.2",
  "candidate": {
    "name": "Broken fixture: a 0.2 report with no classification",
    "pna_spec_version": "0.2",
    "picks_source": "inferred"
  },
  "summary": {
    "posture": "indeterminate",
    "headline": "Deliberately broken fixture: report_schema_version 0.2 without candidate.classification. At 0.2 the Step-0 categorization is recorded as a matter of course — its absence means the evaluate flow skipped the gate. report-fixtures-lint MUST flag this (exit 1)."
  },
  "findings": [
    {
      "ac_id": "AC-1",
      "ac_source": "universal",
      "status": "unable-to-determine",
      "goals": [1, 3],
      "rationale": "Fixture filler so the findings array is otherwise valid."
    }
  ]
}
