{
  "report_schema_version": "0.2",
  "candidate": {
    "name": "Broken fixture: goal-impact mode without goal_impacts",
    "pna_spec_version": "0.2",
    "picks_source": "inferred",
    "classification": {
      "application_class": "messaging client",
      "stores_contact_data": true,
      "stores_relationship_data": true,
      "nexus": "adjacent",
      "nexus_source": "inferred",
      "mode": "goal-impact"
    }
  },
  "summary": {
    "posture": "not-a-pna",
    "headline": "Deliberately broken fixture: a Mode-2 (goal-impact) report with no summary.goal_impacts. The per-Goal read IS the Mode-2 verdict, so its absence leaves the report verdict-less. report-fixtures-lint MUST flag this (exit 1)."
  },
  "findings": [
    {
      "ac_id": "AC-1",
      "ac_source": "universal",
      "status": "not-applicable",
      "goals": [1, 3],
      "rationale": "Fixture filler so the findings array is otherwise valid."
    }
  ]
}
